place,rating,comment,clean_comment,label,cluster
Bali Zoo,5,"We had such a wonderful experience visiting the Bali Zoo. The entire park is beautiful and meticulously maintained, making it a joy to walk through. We took the advice to visit around 10:00 AM.

The absolute highlight of our day was the animal feeding experience. A huge thank you to Wahyudi and his team for being such incredible guides! They made the feeding session so fun, engaging, and personal for us. If you are traveling to Bali, this place is absolutely worth the trip, especially if you have family or just love animals. Don't miss it!",we had such a wonderful experience visiting the bali zoo the entire park is beautiful and meticulously maintained making it a joy to walk through we took the advice to visit around am the absolute highlight of our day was the animal feeding experience a huge thank you to wahyudi and his team for being such incredible guides they made the feeding session so fun engaging and personal for us if you are traveling to bali this place is absolutely worth the trip especially if you have family or just love animals dont miss it,Puas,2
Bali Zoo,5,"Visiting Bali Zoo was a genuinely enjoyable experience. The place is clean, well organized, and feels welcoming from the moment you enter. The animals appear healthy and well cared for, and the enclosures are designed in a way that blends nicely with nature, making the experience feel relaxed rather than crowded.

What I appreciated most was how interactive and educational the visit felt. It’s not just about seeing animals behind fences—the information provided is clear and interesting, and the staff are friendly, attentive, and happy to help, especially around families and children.

The facilities are well maintained, with plenty of places to rest, eat, and take photos. There are enough activities to keep you engaged without feeling rushed, and time passes quickly because there’s so much to see and enjoy. Overall, Bali Zoo is a great place to visit, especially for families or anyone looking for a meaningful and enjoyable day out in Bali.",visiting bali zoo was a genuinely enjoyable experience the place is clean well organized and feels welcoming from the moment you enter the animals appear healthy and well cared for and the enclosures are designed in a way that blends nicely with nature making the experience feel relaxed rather than crowded what i appreciated most was how interactive and educational the visit felt its not just about seeing animals behind fencesthe information provided is clear and interesting and the staff are friendly attentive and happy to help especially around families and children the facilities are well maintained with plenty of places to rest eat and take photos there are enough activities to keep you engaged without feeling rushed and time passes quickly because theres so much to see and enjoy overall bali zoo is a great place to visit especially for families or anyone looking for a meaningful and enjoyable day out in bali,Puas,2
Bali Zoo,5,We had a great day out at this zoo. All the staff are so friendly and the place is clean. The shuttle bus was helpful getting to other areas of the zoo as it was quite a walk especially with kids. There are food carts in a lot of areas and the cafes onsite are great. We would definitely recommend.,we had a great day out at this zoo all the staff are so friendly and the place is clean the shuttle bus was helpful getting to other areas of the zoo as it was quite a walk especially with kids there are food carts in a lot of areas and the cafes onsite are great we would definitely recommend,Puas,2
Bali Zoo,5,"Today my daughter and I went to the Bali Zoo. We were delighted! Such a wonderful day. We saw all the animals, but we liked the elephant and feeding him the most.  Thank  you so much Wahyudi. 🤩👍 I would recommend everyone to visit the zoo, especially those with children! ❤️👏",today my daughter and i went to the bali zoo we were delighted such a wonderful day we saw all the animals but we liked the elephant and feeding him the most thank you so much wahyudi i would recommend everyone to visit the zoo especially those with children,Puas,0
Bali Zoo,5,"Visiting the Bali Zoo was one of the most magical experiences of my trip — truly the best zoo I have ever been to. The place feels like stepping into a Pinterest dream, with beautiful scenery, lush nature, and so many perfect photo spots everywhere you look.

The animals are amazing and well cared for, and the interactive experiences make you feel connected to them in a way that goes far beyond just watching. From feeding different species to touching them and learning about their behavior, every moment feels special and unforgettable.

One of the highlights for me was the educational sessions — learning about birds, eagles, and other animals up close. It’s not just a zoo, it’s a place where you learn, feel, and connect deeply with nature.

The staff is incredibly kind, passionate, and helpful — they truly love the animals and make you feel welcome from the moment you arrive.

A tip: buy your tickets in advance! That way you can enter right away without waiting in line, and enjoy the experience more smoothly.

Bali Zoo is not just a place for kids — it’s a beautiful adventure for everyone. A mix of nature, photography, education, and pure joy. I would go back again in a heartbeat. 🫶🌿",visiting the bali zoo was one of the most magical experiences of my trip truly the best zoo i have ever been to the place feels like stepping into a pinterest dream with beautiful scenery lush nature and so many perfect photo spots everywhere you look the animals are amazing and well cared for and the interactive experiences make you feel connected to them in a way that goes far beyond just watching from feeding different species to touching them and learning about their behavior every moment feels special and unforgettable one of the highlights for me was the educational sessions learning about birds eagles and other animals up close its not just a zoo its a place where you learn feel and connect deeply with nature the staff is incredibly kind passionate and helpful they truly love the animals and make you feel welcome from the moment you arrive a tip buy your tickets in advance that way you can enter right away without waiting in line and enjoy the experience more smoothly bali zoo is not just a place for kids its a beautiful adventure for everyone a mix of nature photography education and pure joy i would go back again in a heartbeat,Puas,2
Jatim Park 1,5,"Jawa Timur Park 1 turned out to be a very satisfying place to spend a full day, especially for a family trip with children. At first glance, we thought the rides might be limited, but once we went deeper inside, we realized there were many more attractions than expected. The park offers a good mix of fun rides, interactive games, and educational elements that keep both kids and adults entertained. The layout encourages visitors to explore, and each area feels different and engaging. Overall, it’s a great destination for families, and definitely suitable for bringing children for a fun, active, and enjoyable day out.",jawa timur park turned out to be a very satisfying place to spend a full day especially for a family trip with children at first glance we thought the rides might be limited but once we went deeper inside we realized there were many more attractions than expected the park offers a good mix of fun rides interactive games and educational elements that keep both kids and adults entertained the layout encourages visitors to explore and each area feels different and engaging overall its a great destination for families and definitely suitable for bringing children for a fun active and enjoyable day out,Puas,1
Jatim Park 1,5,"Amazing experience at JTP 1 💖
We had connecting access from Klub Bunga Theme Park which only cost us 40K/ pax including museum tubuh, really cheap and great offer 🥳",amazing experience at jtp we had connecting access from klub bunga theme park which only cost us k pax including museum tubuh really cheap and great offer,Puas,1
Jatim Park 1,5,"Having great fun and able to explore half day here due raining seasons . Visit on weekdays and great less crowded and they should put more shelter in case heavy rain comes.
Price is start 100ribu rupiah and it’s worth it , to those who have school holidays can bring along their children.",having great fun and able to explore half day here due raining seasons visit on weekdays and great less crowded and they should put more shelter in case heavy rain comes price is start ribu rupiah and its worth it to those who have school holidays can bring along their children,Puas,1
Jatim Park 1,5,"Jatim Park 1 is a vibrant and engaging recreational destination that combines education, entertainment, and adventure in a way that appeals to visitors of all ages. The park offers a wide variety of attractions, from interactive science exhibits and cultural displays to fun rides and themed areas that create an exciting atmosphere throughout the entire space. Its colorful environment, clean facilities, and well-maintained layout make the experience both comfortable and enjoyable, while the staff and safety measures ensure a pleasant visit for families. Overall, Jatim Park 1 stands out as an attractive and memorable place to explore, offering a perfect balance of learning and leisure in one dynamic location.",jatim park is a vibrant and engaging recreational destination that combines education entertainment and adventure in a way that appeals to visitors of all ages the park offers a wide variety of attractions from interactive science exhibits and cultural displays to fun rides and themed areas that create an exciting atmosphere throughout the entire space its colorful environment clean facilities and wellmaintained layout make the experience both comfortable and enjoyable while the staff and safety measures ensure a pleasant visit for families overall jatim park stands out as an attractive and memorable place to explore offering a perfect balance of learning and leisure in one dynamic location,Puas,1
Jatim Park 1,5,"This place is suitable for all ages, the important thing is that young and old have things to prepare themselves, it's a shame to go there when it's raining so you don't ride the super complete rides, only ride 3 rides for the sake of employment safety, that's also good, it's recommended that you go here  from morning so you can enjoy the rides.  The ticket I bought was 110 for all the rides, even though some of the rides were paid, almost all of them were included in the 110 IDR package.  Entering at the beginning of the route you will be treated to museums throughout Indonesia, then ride and go home, don't forget to buy souvenirs.",this place is suitable for all ages the important thing is that young and old have things to prepare themselves its a shame to go there when its raining so you dont ride the super complete rides only ride rides for the sake of employment safety thats also good its recommended that you go here from morning so you can enjoy the rides the ticket i bought was for all the rides even though some of the rides were paid almost all of them were included in the idr package entering at the beginning of the route you will be treated to museums throughout indonesia then ride and go home dont forget to buy souvenirs,Puas,2
Jatim Park 2,5,One words best zoo and museums in Indonesia,one words best zoo and museums in indonesia,Puas,0
Jatim Park 2,5,the most memorable zoo n very exciting,the most memorable zoo n very exciting,Puas,2
Jatim Park 2,5,Wooooow...,wooooow,Puas,0
Jatim Park 2,5,Good,good,Puas,2
Jatim Park 2,5,Virtual immersive park TOP,virtual immersive park top,Puas,1
Museum Angkut,5,"Great museum about transportation. They have all kinds of things and it is very nicely presented. The first room may be a bit less inviting but the further you go into the museum the better it gets. The staff is super friendly and helpful. If you are in Malang, Museum Angkut is a must!",great museum about transportation they have all kinds of things and it is very nicely presented the first room may be a bit less inviting but the further you go into the museum the better it gets the staff is super friendly and helpful if you are in malang museum angkut is a must,Puas,2
Museum Angkut,5,"I would highly recommend Museum Angkut to anyone visiting Kota Batu. We didn't buy the entrance tickets online. It was a short queue at the ticket booth. The museum is an impressive and well-laid out attraction. The place showcases a huge collection of vehicles from the past. I enjoyed seeing them up close and appreciating the beautiful details on these old vehicles - cars, wagons, motorcycles and even model ships and airolanes. They are all so beautiful and it was worth it! Do stop by Cwie Mie Klenteng- a small noodle eatery with a simple menu - everything on the menu was delicious 😋. Beside, museum Angkut, you can walk around the Pasar Ampung.",i would highly recommend museum angkut to anyone visiting kota batu we didnt buy the entrance tickets online it was a short queue at the ticket booth the museum is an impressive and welllaid out attraction the place showcases a huge collection of vehicles from the past i enjoyed seeing them up close and appreciating the beautiful details on these old vehicles cars wagons motorcycles and even model ships and airolanes they are all so beautiful and it was worth it do stop by cwie mie klenteng a small noodle eatery with a simple menu everything on the menu was delicious beside museum angkut you can walk around the pasar ampung,Puas,2
Museum Angkut,5,"Forget Bromo, forget the candis, forget the local food spots everyone keeps recommending. The most underrated place I've ever stepped foot in across all of Indonesia is Museum Angkut, and I genuinely cannot believe more people aren't talking about it.
The name alone tells you what it is, a museum built around transportation, but that description does it zero justice. This place is a full world tour on four wheels. Every vehicle is curated and displayed within its own country setting, so you've got Fiats sitting in an Italian streetscape, Jaguars and Rolls-Royces tucked into a British quarter, Doc Hudson's Chieftain planted right in the middle of a Hollywood strip, and a proud Indonesian collection greeting you the moment you walk in. Then somewhere between the army vehicles, the helicopters, and the bare mechanical engines scattered around like hidden exhibits, it hits you that this isn't just a museum.
What makes it genuinely special is that the whole place is designed like a destination you have to explore yourself. There are no arrows telling you where to go. You just wander, turn a corner, and suddenly you're in a completely different country or era. That sense of discovery is what most museums completely miss.
After this, the car museum I visited in Sentul honestly felt like someone's dusty garage.",forget bromo forget the candis forget the local food spots everyone keeps recommending the most underrated place ive ever stepped foot in across all of indonesia is museum angkut and i genuinely cannot believe more people arent talking about it the name alone tells you what it is a museum built around transportation but that description does it zero justice this place is a full world tour on four wheels every vehicle is curated and displayed within its own country setting so youve got fiats sitting in an italian streetscape jaguars and rollsroyces tucked into a british quarter doc hudsons chieftain planted right in the middle of a hollywood strip and a proud indonesian collection greeting you the moment you walk in then somewhere between the army vehicles the helicopters and the bare mechanical engines scattered around like hidden exhibits it hits you that this isnt just a museum what makes it genuinely special is that the whole place is designed like a destination you have to explore yourself there are no arrows telling you where to go you just wander turn a corner and suddenly youre in a completely different country or era that sense of discovery is what most museums completely miss after this the car museum i visited in sentul honestly felt like someones dusty garage,Puas,2
Museum Angkut,5,"⭐⭐⭐⭐⭐
Museum Angkut in Malang is an outstanding attraction and easily one of the highlights in the area 🚗✨. The museum is very high quality and impressively designed, featuring a wide collection of vehicles from different eras and countries, ranging from classic vintage cars to iconic automobiles and themed exhibits. Each area is thoughtfully arranged, making it both informative and entertaining to walk through.

What makes the visit especially exciting is that every two hours there is a live show, which adds real energy to the experience 🔥🎶. During our visit, there were car performances with burnouts and donuts, which were surprisingly thrilling and very amusing to watch. It’s clear that a lot of effort goes into keeping the museum dynamic and engaging, not just static displays.

The overall atmosphere is lively yet well organized, and the entire complex feels well maintained and professionally run. Whether you are a car enthusiast or simply looking for a unique and fun attraction, Museum Angkut offers excellent value and a memorable experience. A must-visit in Malang.",museum angkut in malang is an outstanding attraction and easily one of the highlights in the area the museum is very high quality and impressively designed featuring a wide collection of vehicles from different eras and countries ranging from classic vintage cars to iconic automobiles and themed exhibits each area is thoughtfully arranged making it both informative and entertaining to walk through what makes the visit especially exciting is that every two hours there is a live show which adds real energy to the experience during our visit there were car performances with burnouts and donuts which were surprisingly thrilling and very amusing to watch its clear that a lot of effort goes into keeping the museum dynamic and engaging not just static displays the overall atmosphere is lively yet well organized and the entire complex feels well maintained and professionally run whether you are a car enthusiast or simply looking for a unique and fun attraction museum angkut offers excellent value and a memorable experience a mustvisit in malang,Puas,1
Pantai Pangandaran,5,"Pangandaran Beach is one of the leading tourist destinations in West Java which has white and black sand and relatively calm waves. The beach is suitable for various activities such as swimming, playing in the sand, or just relaxing.
In addition to enjoying the beach, tourists can visit the really cool Grand Canyon tour.
The facilities around the beach are quite complete, ranging from parking areas, public toilets, to food stalls. Accommodation options are also diverse, from simple lodgings to star hotels.
The entrance ticket per person is IDR 20 thousand, while parking is IDR 15 thousand.
Pangandaran Beach can be accessed from various cities. From Bandung it takes about 6-8 hours, depending on the traffic.
Enjoy the photos and videos.",pangandaran beach is one of the leading tourist destinations in west java which has white and black sand and relatively calm waves the beach is suitable for various activities such as swimming playing in the sand or just relaxing in addition to enjoying the beach tourists can visit the really cool grand canyon tour the facilities around the beach are quite complete ranging from parking areas public toilets to food stalls accommodation options are also diverse from simple lodgings to star hotels the entrance ticket per person is idr thousand while parking is idr thousand pangandaran beach can be accessed from various cities from bandung it takes about hours depending on the traffic enjoy the photos and videos,Puas,0
Pantai Pangandaran,5,Nice place to holiday on beach,nice place to holiday on beach,Puas,0
Pantai Pangandaran,5,"Pangandaran Beach is a relatively affordable destination, making it a great option for budget-minded travelers.
* Friendly locals: The people of Pangandaran are known for their warm hospitality and friendliness.
* Relaxing atmosphere: The beach is a great place to escape the hustle and bustle of city life and relax in a peaceful setting.
* Unique culture: Pangandaran is home to a unique culture that is a blend of Javanese and Sundanese traditions.
* Delicious food: The local cuisine is delicious and varied, with plenty of fresh seafood options.",pangandaran beach is a relatively affordable destination making it a great option for budgetminded travelers friendly locals the people of pangandaran are known for their warm hospitality and friendliness relaxing atmosphere the beach is a great place to escape the hustle and bustle of city life and relax in a peaceful setting unique culture pangandaran is home to a unique culture that is a blend of javanese and sundanese traditions delicious food the local cuisine is delicious and varied with plenty of fresh seafood options,Puas,0
Kebun Raya Bogor,5,"Such a great place to escape the hustle and bustle of Jakarta. It’s easily reachable by public transportation using the commuter line and green angkot (angkutan kota).
The area is huge, but the scenery makes you forget how many steps you’ve walked. There are also several spots where you can rent bikes, either classic or electric.
Make sure to bring your own water to stay hydrated!",such a great place to escape the hustle and bustle of jakarta its easily reachable by public transportation using the commuter line and green angkot angkutan kota the area is huge but the scenery makes you forget how many steps youve walked there are also several spots where you can rent bikes either classic or electric make sure to bring your own water to stay hydrated,Puas,2
Kebun Raya Bogor,5,"A massive and lush green space located right in the heart of the city. Access is easy and the ticket price is relatively cheap. It is very spacious, so renting a vehicle is a good idea. Choices range from bicycles to buggies (or bring your own bike for an extra fee). A notable aspect to keep in mind: rental services and entrance gates will close during heavy rain for safety, so check the weather before you go.",a massive and lush green space located right in the heart of the city access is easy and the ticket price is relatively cheap it is very spacious so renting a vehicle is a good idea choices range from bicycles to buggies or bring your own bike for an extra fee a notable aspect to keep in mind rental services and entrance gates will close during heavy rain for safety so check the weather before you go,Puas,2
Kebun Raya Bogor,5,"Amazing it’s one my favorite statement after visited the great botanical garden in bogor city.

The ticket payment there supports for online like qris or credit card. Open for foreigners

You can finding the great botanical garden in indonesia

We have a durian, salak, angrek on other interests

Don’t worry for visit",amazing its one my favorite statement after visited the great botanical garden in bogor city the ticket payment there supports for online like qris or credit card open for foreigners you can finding the great botanical garden in indonesia we have a durian salak angrek on other interests dont worry for visit,Puas,1
Kebun Raya Bogor,5,"Absolute cinema. Really adore this place. Here it is, an honest review. It’s a park, a big park. It’s green, who doesn’t love green space when you live in the Jabodetabek area. In a perfect world, we would all be having the most of our lives in a safe space like Kebun Raya Bogor. Don’t forget to visit the cafe, treat yourselves to some churros and chocolate milk, or coffee, or tea if you prefer. Scooter rental is also provided, given that you are somewhat confident in your ability to ride one, i’d recommend getting one since it’s a pretty big garden. Walks are always ideal of course, nonetheless.",absolute cinema really adore this place here it is an honest review its a park a big park its green who doesnt love green space when you live in the jabodetabek area in a perfect world we would all be having the most of our lives in a safe space like kebun raya bogor dont forget to visit the cafe treat yourselves to some churros and chocolate milk or coffee or tea if you prefer scooter rental is also provided given that you are somewhat confident in your ability to ride one id recommend getting one since its a pretty big garden walks are always ideal of course nonetheless,Puas,2
