place,rating,comment,clean_comment,label,cluster
Candi Borobudur,5,"The experience at Candi Borobudur was wonderful. Although we were there from 9:30 to 11:00am and the sun was very strong, it was bearable. You can rent parasols or buy hats on site. The electric golf carts that take you from the parking area to the temple are relatively new and a great free service. There weren't too many tourists overall, so it was well-spaced and you could take pictures without people in the frame.",the experience at candi borobudur was wonderful although we were there from to am and the sun was very strong it was bearable you can rent parasols or buy hats on site the electric golf carts that take you from the parking area to the temple are relatively new and a great free service there werent too many tourists overall so it was wellspaced and you could take pictures without people in the frame,Puas,2
Candi Borobudur,5,"Borobudur is an extraordinary site where history, spirituality, and landscape come together in a truly unique way. Walking through the terraces feels like progressing through a living mandala, with the reliefs telling both philosophical teachings and scenes of everyday life from the 8th–9th century. The early morning visit is clearly the best choice: entering at 7:00 allows you to enjoy cooler temperatures, softer light, and a much calmer atmosphere before the larger crowds arrive. The sunrise option, if you can book it, adds a remarkable contemplative dimension with mist over the surrounding hills. Overall, the experience is both intellectually enriching and deeply serene, and I would highly recommend taking the time to explore it slowly and respectfully.",borobudur is an extraordinary site where history spirituality and landscape come together in a truly unique way walking through the terraces feels like progressing through a living mandala with the reliefs telling both philosophical teachings and scenes of everyday life from the thth century the early morning visit is clearly the best choice entering at allows you to enjoy cooler temperatures softer light and a much calmer atmosphere before the larger crowds arrive the sunrise option if you can book it adds a remarkable contemplative dimension with mist over the surrounding hills overall the experience is both intellectually enriching and deeply serene and i would highly recommend taking the time to explore it slowly and respectfully,Puas,2
Candi Borobudur,5,"It was my third times here, this time i felt different and better, because i need to go there with a tour guide. The guide was very nice and explained everything in very understandable way. Paid 150k IDR for local and 400k for foreigner. Better to buy the ticket online to save time. The price is included a pair of sandal and a small mineral water for the foreigner, also return transport from the entrance to the temple.",it was my third times here this time i felt different and better because i need to go there with a tour guide the guide was very nice and explained everything in very understandable way paid k idr for local and k for foreigner better to buy the ticket online to save time the price is included a pair of sandal and a small mineral water for the foreigner also return transport from the entrance to the temple,Puas,2
Candi Borobudur,5,"I pre booked the tickets on Klook and had a seamless experience getting to the monument, they provide a buggy on temple park grounds and that was really nice since the entire compound is pretty huge (still walkable in my opinion). You’ll be given a pair of sandals to protect the temple grounds and a small bottle of mineral water (comes with the climbing admission tickets). The sandals are not the most comfortable, I would recommend sizing up if you have wide feet because the material is scratchy and can cause blisters, if not, it’s quite true to size. The steps are huge so the climb down can be quite dangerous if your sandals are too big.

Personally, as a bigger person, the climb up was very manageable but it can get really hot so take precaution. I suffered a minor heatstroke because I didn’t drink enough water. Don’t drink too much water though because well, you will not be able to acccess the toilets during the hour you spend climbing/ the tour.

Once in a lifetime moment, bucket list item. What can I say? Our guide is very knowledgeable, and answered our curiosities with humour and wit. I enjoyed hearing his enthusiastic descriptions of the panels and the history of the monument. He was kind enough to help us take great photos of the lucky Buddha. I thoroughly enjoyed myself at the monument :)",i pre booked the tickets on klook and had a seamless experience getting to the monument they provide a buggy on temple park grounds and that was really nice since the entire compound is pretty huge still walkable in my opinion youll be given a pair of sandals to protect the temple grounds and a small bottle of mineral water comes with the climbing admission tickets the sandals are not the most comfortable i would recommend sizing up if you have wide feet because the material is scratchy and can cause blisters if not its quite true to size the steps are huge so the climb down can be quite dangerous if your sandals are too big personally as a bigger person the climb up was very manageable but it can get really hot so take precaution i suffered a minor heatstroke because i didnt drink enough water dont drink too much water though because well you will not be able to acccess the toilets during the hour you spend climbing the tour once in a lifetime moment bucket list item what can i say our guide is very knowledgeable and answered our curiosities with humour and wit i enjoyed hearing his enthusiastic descriptions of the panels and the history of the monument he was kind enough to help us take great photos of the lucky buddha i thoroughly enjoyed myself at the monument,Puas,2
Candi Borobudur,5,An amazing experience. And the biggest Buddhist temple in the world! It’s is more accessible that you may think with special help for those less able. Really worth the time. Get enlightened 🙏,an amazing experience and the biggest buddhist temple in the world its is more accessible that you may think with special help for those less able really worth the time get enlightened,Puas,1
Candi Prambanan,5,"Prambanan is one of Indonesia’s most impressive historical landmarks and the largest Hindu temple complex in the country.

Like most visitors, I have visited Prambanan for sightseeing and to admire its history and architecture. However, I also often come here not just as a tourist, but also for jogging in the morning. The roads surrounding the temple complex are surprisingly pleasant for running, with plenty of trees, open views, birds, and a relatively peaceful atmosphere compared to the busy parts of the city.

Whether you're interested in history, photography, culture, or simply looking for a scenic place to exercise, Prambanan offers a unique experience. The temple itself is magnificent, but the surrounding area is equally enjoyable. For me, it has become more than just a tourist destination—it's also one of my favorite places to go for a run and enjoy the outdoors.",prambanan is one of indonesias most impressive historical landmarks and the largest hindu temple complex in the country like most visitors i have visited prambanan for sightseeing and to admire its history and architecture however i also often come here not just as a tourist but also for jogging in the morning the roads surrounding the temple complex are surprisingly pleasant for running with plenty of trees open views birds and a relatively peaceful atmosphere compared to the busy parts of the city whether youre interested in history photography culture or simply looking for a scenic place to exercise prambanan offers a unique experience the temple itself is magnificent but the surrounding area is equally enjoyable for me it has become more than just a tourist destinationits also one of my favorite places to go for a run and enjoy the outdoors,Puas,2
Candi Prambanan,5,"Such a magnificent temples complex. I went there at 4 p.m. It's such a bless cause the sky was so blue with perfect lighting of golden hour so it wasn't as hot as the afternoon. There were still many visitors at that time since it was a long weekend. However, I still enjoyed my visit cause the complex is so large. When I was there, the Hindu prayer was held, so the main temple was closed. I couldn't enter the main temple.

The ticket is cheap for what the area to offer, so it's a worth to visit in Yogyakarta area.",such a magnificent temples complex i went there at pm its such a bless cause the sky was so blue with perfect lighting of golden hour so it wasnt as hot as the afternoon there were still many visitors at that time since it was a long weekend however i still enjoyed my visit cause the complex is so large when i was there the hindu prayer was held so the main temple was closed i couldnt enter the main temple the ticket is cheap for what the area to offer so its a worth to visit in yogyakarta area,Puas,1
Candi Prambanan,5,"Visited Prambanan Temple in the afternoon and had a great experience. The weather was cool, which made walking around the large complex very comfortable. The temples look stunning in the softer afternoon light, and the carvings are incredibly detailed. It can get a bit crowded, but the overall atmosphere is still enjoyable. We stayed until it got dark, but found it a bit difficult to locate the exit. In the end, we exited through the main entrance—fortunately a few staff were still there and allowed us to pass. Staying until sunset definitely made the visit special. Highly recommended.",visited prambanan temple in the afternoon and had a great experience the weather was cool which made walking around the large complex very comfortable the temples look stunning in the softer afternoon light and the carvings are incredibly detailed it can get a bit crowded but the overall atmosphere is still enjoyable we stayed until it got dark but found it a bit difficult to locate the exit in the end we exited through the main entrancefortunately a few staff were still there and allowed us to pass staying until sunset definitely made the visit special highly recommended,Puas,0
Candi Prambanan,5,"Prambanan Temple is an awe-inspiring testament to both human craftsmanship and resilience. These majestic Hindu temples, originally built in the 9th century, have endured earthquakes and the passage of time - yet still stand tall, carefully pieced back together from countless stone fragments

What makes the experience especially powerful is seeing both the restored structures and the areas that remain incomplete. The piles of stones and partially reconstructed sections quietly tell the story of natural disasters and the immense effort required to preserve this heritage site

Despite that, the level of detail is remarkable. The intricate carvings, relief panels, and statues - some still intact after centuries - are stunning up close and reflect a deep level of artistry and devotion

One strong recommendation: pay for a local guide. The site is rich with symbolism and stories, and without context, you’ll miss much of what makes it truly special. A guide brings the history, mythology, and architectural meaning to life

The only downside was the exit experience - you’re funneled through a stretch of stall sellers, which feels crowded and slightly detracts from an otherwise serene and reflective visit",prambanan temple is an aweinspiring testament to both human craftsmanship and resilience these majestic hindu temples originally built in the th century have endured earthquakes and the passage of time yet still stand tall carefully pieced back together from countless stone fragments what makes the experience especially powerful is seeing both the restored structures and the areas that remain incomplete the piles of stones and partially reconstructed sections quietly tell the story of natural disasters and the immense effort required to preserve this heritage site despite that the level of detail is remarkable the intricate carvings relief panels and statues some still intact after centuries are stunning up close and reflect a deep level of artistry and devotion one strong recommendation pay for a local guide the site is rich with symbolism and stories and without context youll miss much of what makes it truly special a guide brings the history mythology and architectural meaning to life the only downside was the exit experience youre funneled through a stretch of stall sellers which feels crowded and slightly detracts from an otherwise serene and reflective visit,Puas,2
Gunung Bromo,5,"Wonderful spiritual pilgramage place, magnificent to see nature and experience a live volcano from the crater. The walk to the volcano is not too challenging but doable and your efforts are rewarded once you make it to the top. Thank you to all the visitors for keeping the place clean and disposing of your rubbish properly.",wonderful spiritual pilgramage place magnificent to see nature and experience a live volcano from the crater the walk to the volcano is not too challenging but doable and your efforts are rewarded once you make it to the top thank you to all the visitors for keeping the place clean and disposing of your rubbish properly,Puas,2
Gunung Bromo,5,"Mount Bromo is a truly magical place.

Climbing up to the crater is an unforgettable experience – you can see steam rising from inside and hear the deep, almost boiling sounds coming from the volcano. It feels raw and powerful, like nature at its core.

The hike is quite steep, and there are no protective fences at the top, so be very careful – it’s easy to get too close to the edge.

The sunrise viewpoint before heading to the crater is absolutely stunning and definitely worth it.

A quick tip: dress warm, but not too warm – you don’t want to overheat during the climb. The temperature is around 12°C in April. A fleece layer, a light windproof jacket, thermal underwear, comfortable pants, and warm socks will be enough. Also consider a beanie, neck protection, and light gloves.

Highly recommended – this place truly leaves a lasting impression.

We visited with Beng Beng Travel & Tour guides, and it was a great experience.",mount bromo is a truly magical place climbing up to the crater is an unforgettable experience you can see steam rising from inside and hear the deep almost boiling sounds coming from the volcano it feels raw and powerful like nature at its core the hike is quite steep and there are no protective fences at the top so be very careful its easy to get too close to the edge the sunrise viewpoint before heading to the crater is absolutely stunning and definitely worth it a quick tip dress warm but not too warm you dont want to overheat during the climb the temperature is around c in april a fleece layer a light windproof jacket thermal underwear comfortable pants and warm socks will be enough also consider a beanie neck protection and light gloves highly recommended this place truly leaves a lasting impression we visited with beng beng travel tour guides and it was a great experience,Puas,2
Gunung Bromo,5,"FANTASTIC! It was less than 2miles round trip but between walking across the shifting sea of sands, crumbly uphill and 250 steps, the ~500ft elevation gain felt challenging given that we had got acclimatized to sea level. My altimeter measured 7,020ft/2,175m elevation at the start and 7,505ft/2,287m at the crater rim vs 31ft/9m at our home stay in Probolinggo. We started our hike at 6:20am and it was relatively uncrowded. The hike did feel very pleasant and not too cold or hot. The views at every moment were spectacular! When we did get to the top, the sounds and smells of the volcano were thrilling. Absolutely wonderful overall experience!

Practical Considerations:
- there are LOTS of jeeps here too so keep track of where you park and the license plate if your vehicle
- dress in layers as it could be cool/cold to start and warm after walking to the top.
- consider bring a mask/buff to block out the dust kicked up by people and horses
- Be aware that there could be a lot of horses to walk past to get to the stairs, and they could buck/kick if spooked.
- when the wind shifts the direction of the thick white plumes from Mt Bromo, it can cause irritation to eyes, skin and lungs as the sulphur compounds in the emissions mix with moisture in those areas forming sulphuric acid. This was primarily why we limited our time at the top as we did not have gas masks.",fantastic it was less than miles round trip but between walking across the shifting sea of sands crumbly uphill and steps the ft elevation gain felt challenging given that we had got acclimatized to sea level my altimeter measured ftm elevation at the start and ftm at the crater rim vs ftm at our home stay in probolinggo we started our hike at am and it was relatively uncrowded the hike did feel very pleasant and not too cold or hot the views at every moment were spectacular when we did get to the top the sounds and smells of the volcano were thrilling absolutely wonderful overall experience practical considerations there are lots of jeeps here too so keep track of where you park and the license plate if your vehicle dress in layers as it could be coolcold to start and warm after walking to the top consider bring a maskbuff to block out the dust kicked up by people and horses be aware that there could be a lot of horses to walk past to get to the stairs and they could buckkick if spooked when the wind shifts the direction of the thick white plumes from mt bromo it can cause irritation to eyes skin and lungs as the sulphur compounds in the emissions mix with moisture in those areas forming sulphuric acid this was primarily why we limited our time at the top as we did not have gas masks,Puas,2
Gunung Bromo,5,"If you are considering going to Mount Bromo without a jeep tour, definitely bring a motorbike that is above 125 cc. This will help you get across the sea of sand if you choose to ride instead of walk. I rented one in Surabaya and the drive to Bromo and back was horrible. There’s so much traffic and the road is packed. It takes much much longer than Google maps says. So, if you’re opting to rent a scooter, rent one in Probolinggo and the drive will be much shorter and mostly on a beautiful mountain road.

I also highly recommend going to the crater first. Most people go to the Sunrise Hill, which may or may not have a good view, depending on the clouds and will definitely be crowded with people and jeeps. Going to the crater first allows you the chance to see the red flames inside. And you will have it all to yourself. Then, you can proceed to Seruni point after sunrise to see the panorama and again have the place all to yourself!",if you are considering going to mount bromo without a jeep tour definitely bring a motorbike that is above cc this will help you get across the sea of sand if you choose to ride instead of walk i rented one in surabaya and the drive to bromo and back was horrible theres so much traffic and the road is packed it takes much much longer than google maps says so if youre opting to rent a scooter rent one in probolinggo and the drive will be much shorter and mostly on a beautiful mountain road i also highly recommend going to the crater first most people go to the sunrise hill which may or may not have a good view depending on the clouds and will definitely be crowded with people and jeeps going to the crater first allows you the chance to see the red flames inside and you will have it all to yourself then you can proceed to seruni point after sunrise to see the panorama and again have the place all to yourself,Puas,2
Gunung Bromo,5,"Absolutely incredible stunning place in Indonesia and a must do, Its hard getting up so early in the morning to take the cool jeeps up the mountain for the sunset of Mt bromo and unfortunately we didnt get the beautiful sunset we were hoping for but it was still totally worth it once we got down to the base of mt bromo the the fog had cleared and it was gorgeous seeing the mountains and all the horses you can also rent for a ride, then once we hiked to the top of Mt bromo what wasnt to bad it was so incredible seeing the volcano plume its smoke and hear it roar. It is a bucket list worthy place and I highly recommend going to it.",absolutely incredible stunning place in indonesia and a must do its hard getting up so early in the morning to take the cool jeeps up the mountain for the sunset of mt bromo and unfortunately we didnt get the beautiful sunset we were hoping for but it was still totally worth it once we got down to the base of mt bromo the the fog had cleared and it was gorgeous seeing the mountains and all the horses you can also rent for a ride then once we hiked to the top of mt bromo what wasnt to bad it was so incredible seeing the volcano plume its smoke and hear it roar it is a bucket list worthy place and i highly recommend going to it,Puas,2
Malioboro,5,"The road is always busy with various domestic and foreign tourists. The food is delicious and cheap, suitable for a place to buy souvenirs.",the road is always busy with various domestic and foreign tourists the food is delicious and cheap suitable for a place to buy souvenirs,Puas,2
Malioboro,5,"Jogja, Malioboro, and around km.0 at night. Nice time to wait for to see crowd gathering doing anything.",jogja malioboro and around km at night nice time to wait for to see crowd gathering doing anything,Puas,2
Malioboro,5,"Yesterday, i visited Malioboro. Malioboro is one of the most popular tourist attractions in Yogyakarta. One thing that i liked about Malioboro is its facilities. There are many benches along the sidewalk, a Tourist Information Center, a bus stop, and free drinking water refill stations. It is also a perfect place for shopping and enjoying local culinary experiences. Visitors can also take photos because there are plenty of good spots. However, Malioboro can be very crowded during weekends and holidays. The weather is also quite hot during the daytime. Overall, i enjoyed my visit to Malioboro. It is a good destination for those who want to explore Yogyakarta and enjoy its lively atmosphere.🍃😌🫶🏻🫰🏻🌷",yesterday i visited malioboro malioboro is one of the most popular tourist attractions in yogyakarta one thing that i liked about malioboro is its facilities there are many benches along the sidewalk a tourist information center a bus stop and free drinking water refill stations it is also a perfect place for shopping and enjoying local culinary experiences visitors can also take photos because there are plenty of good spots however malioboro can be very crowded during weekends and holidays the weather is also quite hot during the daytime overall i enjoyed my visit to malioboro it is a good destination for those who want to explore yogyakarta and enjoy its lively atmosphere,Puas,1
Malioboro,5,"This place is very nice and good.You can find many delicious tradisional food, You should try it.",this place is very nice and goodyou can find many delicious tradisional food you should try it,Puas,2
Malioboro,5,"Visited Malioboro area pretty early this time.  Arrived about 7 in thr morning. From middle area of Malioboro street to the Vredeburg, people were walking the pedestrian or stop to sit or enjoying street breakfast or take pictures. Some stores especially those nearby Beringharjo Market already opened.
Visited it many times. Never get bored.",visited malioboro area pretty early this time arrived about in thr morning from middle area of malioboro street to the vredeburg people were walking the pedestrian or stop to sit or enjoying street breakfast or take pictures some stores especially those nearby beringharjo market already opened visited it many times never get bored,Puas,2
Raja Ampat,5,"Raja Ampat was honestly one of the prettiest places i’ve ever been to. super grateful i got to experience it. the water, the views, the snorkeling spots, the whole vibe there just felt so special. the kids at Yenbuba Island were also so sweet, especially Marinus. if anyone meets him, titip salam from me. definitely one of those places that stays in your head even after you leave 🤍 wish i had a GoPro or a drone",raja ampat was honestly one of the prettiest places ive ever been to super grateful i got to experience it the water the views the snorkeling spots the whole vibe there just felt so special the kids at yenbuba island were also so sweet especially marinus if anyone meets him titip salam from me definitely one of those places that stays in your head even after you leave wish i had a gopro or a drone,Puas,2
Raja Ampat,5,"I don't understand why so many people go to Bali and ignore this stunning island. I only go to Bali to visit my friend, but this island is much better for me.",i dont understand why so many people go to bali and ignore this stunning island i only go to bali to visit my friend but this island is much better for me,Puas,0
Raja Ampat,5,"Great spot for divers and snorkelers. You can live abroad on a dive ship or on land in many beach villas, overwater villas or home stays, depending on your budget and interests. Incredible spot with many islands and villages with incredibly hospitable and beautiful people.",great spot for divers and snorkelers you can live abroad on a dive ship or on land in many beach villas overwater villas or home stays depending on your budget and interests incredible spot with many islands and villages with incredibly hospitable and beautiful people,Puas,2
