place,rating,comment,clean_comment,label,cluster
Danau Toba,5,"Stunning landscape, well worth a visit. Very friendly locals around the lake.",stunning landscape well worth a visit very friendly locals around the lake,Puas,1
Danau Toba,5,Beautiful Danau Toba but too bad we didn't have time to go up to the viewing point as we were on a day tour. It was hot and humid but there was a cooling breeze due to high elevation. Our cruise Star Voyager docked on Kuala Tanjung so it was about a 3 hour journey to Lake Toba,beautiful danau toba but too bad we didnt have time to go up to the viewing point as we were on a day tour it was hot and humid but there was a cooling breeze due to high elevation our cruise star voyager docked on kuala tanjung so it was about a hour journey to lake toba,Puas,2
Danau Toba,5,"Review of Lake Toba and Samosir Island

Lake Toba and Samosir Island offer a breathtaking escape into nature’s tranquility. The moment you arrive, the sheer beauty of the landscape captivates you. The lake itself, an immense volcanic crater, stretches endlessly with its calm, crystal-clear waters reflecting the lush green surroundings. It’s a sight that feels almost surreal, making you question whether you’re still in Indonesia or have stumbled into a hidden paradise.

The greenery is overwhelming in the best possible way—everywhere you look, you’re greeted by rolling hills blanketed in vibrant foliage. The air is fresh and crisp, adding to the sense of serenity that envelopes the area. Samosir Island, nestled at the heart of the lake, feels like a world of its own, with its charming villages, rich Batak culture, and an atmosphere of pure peace.

What makes Lake Toba and Samosir truly magical is how untouched and pristine everything feels. Despite its size and grandeur, the lake is wonderfully calm, exuding a quiet majesty that soothes the soul. It’s an experience unlike any other, a perfect destination for anyone seeking a retreat into natural beauty.

If you’re looking for a place that combines serenity, stunning vistas, and a unique cultural experience, Lake Toba and Samosir Island are an absolute must-visit.",review of lake toba and samosir island lake toba and samosir island offer a breathtaking escape into natures tranquility the moment you arrive the sheer beauty of the landscape captivates you the lake itself an immense volcanic crater stretches endlessly with its calm crystalclear waters reflecting the lush green surroundings its a sight that feels almost surreal making you question whether youre still in indonesia or have stumbled into a hidden paradise the greenery is overwhelming in the best possible wayeverywhere you look youre greeted by rolling hills blanketed in vibrant foliage the air is fresh and crisp adding to the sense of serenity that envelopes the area samosir island nestled at the heart of the lake feels like a world of its own with its charming villages rich batak culture and an atmosphere of pure peace what makes lake toba and samosir truly magical is how untouched and pristine everything feels despite its size and grandeur the lake is wonderfully calm exuding a quiet majesty that soothes the soul its an experience unlike any other a perfect destination for anyone seeking a retreat into natural beauty if youre looking for a place that combines serenity stunning vistas and a unique cultural experience lake toba and samosir island are an absolute mustvisit,Puas,2
Danau Toba,5,"Lake Toba in Medan really amazed me. The lake is so big, and the hills and mountains around it make the view beautiful and peaceful. It felt like the perfect place to relax and escape the busy city life.

I especially loved visiting Samosir Island. The Batak culture is interesting, and walking around the villages with views of the lake was amazing.
There’s a lot to do there, like boating or hiking to enjoy the views. Overall, Lake Toba is a place I’ll always remember, so calm and beautiful, it’s definitely worth visiting.🌟🌟🌟🌟 🌟",lake toba in medan really amazed me the lake is so big and the hills and mountains around it make the view beautiful and peaceful it felt like the perfect place to relax and escape the busy city life i especially loved visiting samosir island the batak culture is interesting and walking around the villages with views of the lake was amazing theres a lot to do there like boating or hiking to enjoy the views overall lake toba is a place ill always remember so calm and beautiful its definitely worth visiting,Puas,2
Pantai Kuta Bali,1,"Beach is dirty ,unkept with stones and rocks jutting out dangerously.
Congested with shops,cafes and freelance vendors pestering tourists, the only grace is the peaceful sunset views alongwith the flights taking off in the backdrop.
Lots of work under progress along the beach is hampering free movement to visitors .
Not worth a visit.",beach is dirty unkept with stones and rocks jutting out dangerously congested with shopscafes and freelance vendors pestering tourists the only grace is the peaceful sunset views alongwith the flights taking off in the backdrop lots of work under progress along the beach is hampering free movement to visitors not worth a visit,Kecewa,0
Pantai Kuta Bali,1,"I would not be exaggerating in saying that this was one of the dirtiest beaches I have visited. The water quality was quite poor, and I would not recommend it for swimming. However, it may still be suitable for a beach walk or enjoying the shoreline views",i would not be exaggerating in saying that this was one of the dirtiest beaches i have visited the water quality was quite poor and i would not recommend it for swimming however it may still be suitable for a beach walk or enjoying the shoreline views,Kecewa,2
Pantai Kuta Bali,5,"The beach is not the best, but the sunset here is one of the best in bali. Almost every time we visit bali, we visit kuta beach especially during sunset 🌇. This beach is also near the Hardrock cafe & shops and many restaurants from local foods to international menus.",the beach is not the best but the sunset here is one of the best in bali almost every time we visit bali we visit kuta beach especially during sunset this beach is also near the hardrock cafe shops and many restaurants from local foods to international menus,Puas,0
Pantai Kuta Bali,2,"The dirtiest beach I've seen in my time in Bali..I've seen many beautiful beaches in Bali, and finally I saw this one, but I was a little confused...polythene everywhere, it's disgusting to walk in the waves, the polythene floats in the water and gets stuck in your feet..., I was also confused when I saw little children begging around there...😥",the dirtiest beach ive seen in my time in baliive seen many beautiful beaches in bali and finally i saw this one but i was a little confusedpolythene everywhere its disgusting to walk in the waves the polythene floats in the water and gets stuck in your feet i was also confused when i saw little children begging around there,Kecewa,0
Pantai Parangtritis,5,We came to this beach by hiring a jeep. The price was expensive but the driver was skilled and friendly. The sand here is black in colour and the waves are very high but beautiful. It's nice to wait for the sunset here which is scenic and romantic.,we came to this beach by hiring a jeep the price was expensive but the driver was skilled and friendly the sand here is black in colour and the waves are very high but beautiful its nice to wait for the sunset here which is scenic and romantic,Puas,0
Pantai Parangtritis,5,"A fun beach escape with endless activities: — jeep rides on the sand dunes, paragliding, horse riding, andong rides, go-kart, swimming, and more 🌊✨",a fun beach escape with endless activities jeep rides on the sand dunes paragliding horse riding andong rides gokart swimming and more,Puas,2
Pantai Parangtritis,5,😍,,Puas,0
Kawah Ijen,5,"Absolutely amazingly stunning place in Indonesia and a must do, The hike is hard although you can pay someone to wheel you up and down and its hard getting up so early in the morning to see blue fire but it is so worth it and you will not be disappointed it is a bucket list worthy place and I highly recommend going to it.",absolutely amazingly stunning place in indonesia and a must do the hike is hard although you can pay someone to wheel you up and down and its hard getting up so early in the morning to see blue fire but it is so worth it and you will not be disappointed it is a bucket list worthy place and i highly recommend going to it,Puas,2
Kawah Ijen,5,"Get ready for a 2h hike up for one of the most breathtaking views on East Java.
If the way down is too steep, get a local « Lamborghini » to take you down for a small price",get ready for a h hike up for one of the most breathtaking views on east java if the way down is too steep get a local lamborghini to take you down for a small price,Puas,1
Kawah Ijen,5,"Not easy to go here, wake up early at 2m to move to the base of the mountain, 3-4 hours trekking to the top of Ijen. As long as you don't give up, you can reach there. If you can't trek for longer, don't worry, they have special taxi service to carry you there 😆",not easy to go here wake up early at m to move to the base of the mountain hours trekking to the top of ijen as long as you dont give up you can reach there if you cant trek for longer dont worry they have special taxi service to carry you there,Puas,2
Kawah Ijen,5,"My friend and I came from Bali by motorbike. It was a magical, surreal experience. The trekking lasted 2.5 hours. The journey started at 1 am, ended at sunrise in the mountain. At least once in a lifetime experience. Every moment was worth it.",my friend and i came from bali by motorbike it was a magical surreal experience the trekking lasted hours the journey started at am ended at sunrise in the mountain at least once in a lifetime experience every moment was worth it,Puas,2
Monas Jakarta,5,"For those who visit this place, FYI They’re CLOSED in every Monday. You can only take picture outside the monument. After second day visit, I finally can explore the Monument until reach the top of it. I spend time to see around, and finally found the gate to enter inside, to explore the museum and the top, you must buy the ticket under ground. Do not enter the gate around monument without ticket, you will be shouted from the security there and they asked you to enter from the ground. The ticket price for adult is 8K only museum visit, and 24K for peak monument visit.
Inside there are dioramas that explain about the history of Jakarta in the first floor, and the second will be small stadium to see the Big map on the wall or Garuda’s bird which is Indonesia Symbol. And the last 3rd floor is the resepsionis where we can show the ticket to access the peak monument. There will be a small lift and the man who can operate the lift, while you can listen to Indonesian song in the lift they play. And finally you can see the top of Jakarta View from Monument. You can see the old library or National Library of Jakarta, Istiqlal Mosque, HI roundabout and many more. Which only 24K it’s all worth it. Also when you’re finished to explore, they have free like car (odong”) or bagy car whatever you name it. It’s free as long as you still have your ticket, so don’t throw away. It will be beneficial to take you to the front gate without walking far away. Well, local said; “ you have not visit Jakarta if you don’t come to National Monument. “",for those who visit this place fyi theyre closed in every monday you can only take picture outside the monument after second day visit i finally can explore the monument until reach the top of it i spend time to see around and finally found the gate to enter inside to explore the museum and the top you must buy the ticket under ground do not enter the gate around monument without ticket you will be shouted from the security there and they asked you to enter from the ground the ticket price for adult is k only museum visit and k for peak monument visit inside there are dioramas that explain about the history of jakarta in the first floor and the second will be small stadium to see the big map on the wall or garudas bird which is indonesia symbol and the last rd floor is the resepsionis where we can show the ticket to access the peak monument there will be a small lift and the man who can operate the lift while you can listen to indonesian song in the lift they play and finally you can see the top of jakarta view from monument you can see the old library or national library of jakarta istiqlal mosque hi roundabout and many more which only k its all worth it also when youre finished to explore they have free like car odong or bagy car whatever you name it its free as long as you still have your ticket so dont throw away it will be beneficial to take you to the front gate without walking far away well local said you have not visit jakarta if you dont come to national monument,Puas,2
Monas Jakarta,5,"Monas remains one of Jakarta’s most iconic landmarks, offering rich history, impressive architecture, and a great panoramic view of the city. The surrounding park is spacious and enjoyable for walking, making it a worthwhile stop for both tourists and locals.

However, the experience can be improved, especially for visitors with disabilities. The facilities are still quite limited, making accessibility challenging for those who require additional support. Additionally, there is only one lift available for all visitors heading to the top, which results in long waiting times and slower movement, especially during busy hours.

Despite these areas for improvement, Monas is still a significant cultural attraction with plenty to appreciate. A better focus on accessibility and visitor flow would elevate it even more.",monas remains one of jakartas most iconic landmarks offering rich history impressive architecture and a great panoramic view of the city the surrounding park is spacious and enjoyable for walking making it a worthwhile stop for both tourists and locals however the experience can be improved especially for visitors with disabilities the facilities are still quite limited making accessibility challenging for those who require additional support additionally there is only one lift available for all visitors heading to the top which results in long waiting times and slower movement especially during busy hours despite these areas for improvement monas is still a significant cultural attraction with plenty to appreciate a better focus on accessibility and visitor flow would elevate it even more,Puas,1
Monas Jakarta,5,"MONAS is one of must-visit spot in Jakarta while you visiting here. If you want to get to the top of the monument, the ticket can be bought as you walk in. Only 1000 pax each day available.
Coming here in the morning is highly recommended to avoid congestion and overcrowd.
To get the ticket, you need to access from the back side of the building. Many of visitors got confused knowing that the front area where mostly people walk in to, not yet to be open as a main entrance. It is a bit inconvenient. But there is a free shuttle that can take you to the ticketing station.
Hope this helps you to better plan your visit soon 😉",monas is one of mustvisit spot in jakarta while you visiting here if you want to get to the top of the monument the ticket can be bought as you walk in only pax each day available coming here in the morning is highly recommended to avoid congestion and overcrowd to get the ticket you need to access from the back side of the building many of visitors got confused knowing that the front area where mostly people walk in to not yet to be open as a main entrance it is a bit inconvenient but there is a free shuttle that can take you to the ticketing station hope this helps you to better plan your visit soon,Puas,2
Taman Mini Indonesia Indah,5,"This is one of my favorite places I’ve visited in Jakarta 😍 It’s truly beautiful, full of nature and greenery. You can rent an electric scooter or bike to get around there are also free shuttle buses provided. There are many places selling snacks, biscuits, and food. I loved seeing the different Indonesian cultures and provinces, as well as the temples with their beautiful designs. I also loved the different areas and the photobooths provided. The staff are very helpful and friendly, all the museums are lovely, and it’s such an amazing experience. I would definitely recommend visiting if you’re in Jakarta!❤️",this is one of my favorite places ive visited in jakarta its truly beautiful full of nature and greenery you can rent an electric scooter or bike to get around there are also free shuttle buses provided there are many places selling snacks biscuits and food i loved seeing the different indonesian cultures and provinces as well as the temples with their beautiful designs i also loved the different areas and the photobooths provided the staff are very helpful and friendly all the museums are lovely and its such an amazing experience i would definitely recommend visiting if youre in jakarta,Puas,1
Taman Mini Indonesia Indah,5,"🌈We visited this amazing place in a rainy afternoon but still, it was so tidy and charming with relatively cheap price, rp. 20k per visitor.
🎞️A comprehensive introduction to Indonesia’s 38 provinces, making it a popular destination for both educational school trips and family recreation. Following a major revitalization in 2023, the park now emphasizes a ""green, inclusive, culture, and smart"" concept, with 70% of the area dedicated to lush green spaces.
💫The park’s centerpiece consists of full-scale replicas of traditional houses from across Indonesia, where visitors can study unique regional architecture, costumes, and daily artifacts.
🪸A man-made lake in the center of the park features small islands shaped like the Indonesian archipelago, which can be viewed from above via a scenic cable car ride.
⚠️ Note: Blue bird taxi near the entrance is scammers, they will charge visitors in some different ways. Just be careful!!!",we visited this amazing place in a rainy afternoon but still it was so tidy and charming with relatively cheap price rp k per visitor a comprehensive introduction to indonesias provinces making it a popular destination for both educational school trips and family recreation following a major revitalization in the park now emphasizes a green inclusive culture and smart concept with of the area dedicated to lush green spaces the parks centerpiece consists of fullscale replicas of traditional houses from across indonesia where visitors can study unique regional architecture costumes and daily artifacts a manmade lake in the center of the park features small islands shaped like the indonesian archipelago which can be viewed from above via a scenic cable car ride note blue bird taxi near the entrance is scammers they will charge visitors in some different ways just be careful,Puas,2
Taman Mini Indonesia Indah,5,"TMII is absolutely huge and you can't even visit evrything in one day, but it gives you an amazing overview of the entire country with all the different pavilions with traditional houses, expositions, performances, and lovely people who enjoy explaining their culture and history. Don't miss out on rideing the cable car tonsee the archipellago lake from above.",tmii is absolutely huge and you cant even visit evrything in one day but it gives you an amazing overview of the entire country with all the different pavilions with traditional houses expositions performances and lovely people who enjoy explaining their culture and history dont miss out on rideing the cable car tonsee the archipellago lake from above,Puas,2
Taman Mini Indonesia Indah,5,"We just finished our tour in Taman Mini. It was great. We came here at 9.30, still not so many people and not so hot.

Love the komodo museum, the air tawar museum and the serangga museum were also great. We went to padang house too, which is great and in Papua house we got lots of explanations from a Papua guy who is looking after the place. That was really really nice.

I have been in Taman Mini since I was small, and very happy that the government maintain it well and keep up grated. Well done. It's great walking around there and seeing the beauties of Indonesia in one place.",we just finished our tour in taman mini it was great we came here at still not so many people and not so hot love the komodo museum the air tawar museum and the serangga museum were also great we went to padang house too which is great and in papua house we got lots of explanations from a papua guy who is looking after the place that was really really nice i have been in taman mini since i was small and very happy that the government maintain it well and keep up grated well done its great walking around there and seeing the beauties of indonesia in one place,Puas,1
Tangkuban Perahu,5,The weather was cool on top top of the volcano. Way better than in the city. Its a touristy spot because there are plenty of shops and eatery. The craters are majestic and picturesque. Its nice to hike and see the other crater tuck away on the other side.,the weather was cool on top top of the volcano way better than in the city its a touristy spot because there are plenty of shops and eatery the craters are majestic and picturesque its nice to hike and see the other crater tuck away on the other side,Puas,2
Tangkuban Perahu,2,Nice view of the crater at view point. Do not go for private tour to Kawah Domas until u get all the prices for guide agreed before hand. Expensive lesson learnt for us.,nice view of the crater at view point do not go for private tour to kawah domas until u get all the prices for guide agreed before hand expensive lesson learnt for us,Kecewa,2
Tangkuban Perahu,5,"An amazing experience to have! It’s actually not too long to get there from Bandung city on a weekday, which made the trip very manageable 🚗 The volcano is semi-active, and there’s an amazing viewpoint at the top with incredible scenery 🌋✨ They also have a few activities for kids, as well as food options and plenty of shopping stalls to explore. Overall, a great place to visit for all ages.",an amazing experience to have its actually not too long to get there from bandung city on a weekday which made the trip very manageable the volcano is semiactive and theres an amazing viewpoint at the top with incredible scenery they also have a few activities for kids as well as food options and plenty of shopping stalls to explore overall a great place to visit for all ages,Puas,1
Pantai Sanur Bali,5,"Sanur itself is a nice relaxing area full of beautiful Balinese Locals Travelers and expats.
We would definitely recommend staying in Sanur if you want that Local beach vibe and a little slower pace then other parts of Bali.
Great for families Friends and food.
Great Selection of beach side restaurants and a very modern Mall Icon Bali for shopping or a bite to eat.",sanur itself is a nice relaxing area full of beautiful balinese locals travelers and expats we would definitely recommend staying in sanur if you want that local beach vibe and a little slower pace then other parts of bali great for families friends and food great selection of beach side restaurants and a very modern mall icon bali for shopping or a bite to eat,Puas,0
Pantai Sanur Bali,5,"After landing , I stayed first night in sanur , near to the airport and relaxed so you can go gradually into Bali atmosphere.",after landing i stayed first night in sanur near to the airport and relaxed so you can go gradually into bali atmosphere,Puas,2
Pantai Sanur Bali,5,Pratama Bali Tours takes you everywhere in Bali according to your interests. The price is good and service excellent.,pratama bali tours takes you everywhere in bali according to your interests the price is good and service excellent,Puas,0
Pantai Sanur Bali,5,From here you can enjoy the peaceful beach it's much calm than then the one in front of double six beach and the sand look nicer the overall image look more colourful.. nice for walk nice for cycling nice for diving there are offices to dive with. There are restaurants and cafes near by and long beach ⛱️ ends up in icon mall beach which about 30mins walk 🚶‍♂️.. In bali where ever you go you find a new interesting enjoyment 😉 so have fun,from here you can enjoy the peaceful beach its much calm than then the one in front of double six beach and the sand look nicer the overall image look more colourful nice for walk nice for cycling nice for diving there are offices to dive with there are restaurants and cafes near by and long beach ends up in icon mall beach which about mins walk in bali where ever you go you find a new interesting enjoyment so have fun,Puas,0
